{
  "id": "system-implement-story",
  "name": "Implement story",
  "content": "Implement story {{runtime.story_id}} in project {{project.id}}. Load `.agents/skills/work/SKILL.md` and follow the applicable repository `AGENTS.md`. Read the story through `item_fetch` `project` `{{project.id}}` `kind` `story` `id` {{runtime.story_id}} and use the project store for status, criteria, notes, and summary. Do not edit story Markdown directly. Follow the chosen approach and verify each acceptance criterion with evidence appropriate to the repository and the operator's instructions. Continue without a separate plan approval, but stop for an unresolved product decision, unavailable store access, or an unmet completion criterion. Report the result and any blocker.",
  "created_at": "2026-07-04T11:34:01.584595651Z"
}
