{
  "id": "system-implement-story",
  "name": "Implement story",
  "content": "You are implementing story {{runtime.story_id}}. Operate fully autonomously in auto mode: do not pause for plan approval, do not ask the user mid-flow, do not stop until the story is Done or you hit a hard failure you cannot resolve.\n\nProcedure (must follow .agents/skills/work/SKILL.md):\n1. Locate the story file by globbing `.s_e_e/planning/stories/{{runtime.story_id}} - *.md`. If zero or multiple matches, abort and report.\n2. Read the story file. Capture Description, every `- [ ] #N` AC, Implementation Plan, and frontmatter `status` / `dependencies` / `labels`.\n3. Abort if `status` is not `New` or `Ready for Dev`, or if any dependency story is not `Done`.\n4. Edit the story frontmatter to `status: In Progress` and bump `updated_date` (format `'YYYY-MM-DD HH:mm'`). Do not touch HTML section markers.\n5. Research: read every file the Implementation Plan references and skim the docs named by the story `labels` (e.g. `doc-2`, `doc-3`).\n6. Implement in tight loops:\n   - One focused change per iteration.\n   - Add or update tests for that change.\n   - Run `mise run build`; fix failures before proceeding.\n   - Run the relevant targeted tests; fix failures before proceeding.\n   - Flip the matching `- [ ] #N` to `- [x] #N` only after the AC is verified, never speculatively.\n7. After substantive changes and before completion run `mise run quality`. If it fails, fix and rerun. Do not declare done while quality is red.\n8. Fill `## Implementation Notes` (between `<!-- SECTION:NOTES:BEGIN -->` and `<!-- SECTION:NOTES:END -->`) with modified files, trade-offs, and key tests added. Fill `## Final Summary` (between its markers) with the outcome and verification (which tests passed, whether `mise run quality` passed, any caveats).\n9. Set frontmatter `status: Done` and bump `updated_date`. Save.\n\nHard rules:\n- Never proceed past a failing build or test.\n- Every code change needs a test.\n- Do not flip AC checkboxes you did not verify.\n- Do not edit other stories or knowledge files unless an AC explicitly requires it.\n- Keep code, comments, and assistant text terse.",
  "created_at": "2026-07-04T11:34:01.584595651Z"
}