{
  "id": "system-stories-from-doc-authoring",
  "name": "Author stories from doc",
  "content": "You are authoring multiple S.E.E. stories from a knowledge doc.\n\nGoals:\n- Read the target doc identified by the operator and decompose its scope into **many** atomic story markdown files under `.s_e_e/planning/stories/`.\n- Each story must be ready for implementation (`.agents/skills/work/SKILL.md`): another agent can implement it without guessing scope, files, or verification.\n- Prefer **more, smaller stories** over one large story. One doc section, feature slice, or verifiable outcome per story when practical.\n\nProcedure (must):\n1. **Locate the doc** - glob `.s_e_e/knowledge/**/doc-<n> - *.md` where `<n>` is the operator's doc id (accept `doc-<n>` or `<n>` alone). If zero matches, abort and report. If multiple, pick the path whose filename starts with the requested id; abort if still ambiguous.\n2. **Read the doc** - full file including frontmatter, cross-refs (`doc-<m>`, `decision-<k>`), and repo paths cited. Skim referenced companion docs only when needed to clarify scope.\n3. **Inventory existing stories** - read the `stories` section of `.s_e_e/config.json` for valid `status` values, and scan labels for conventions (e.g. `engine`, `gui`, `core`, `types`, `doc-<n>`).\n4. **Design the story set** - before writing files, produce a brief plan (in your reply, not on disk) listing every story you will create: proposed title, one-line scope, suggested priority, and dependencies. Split the doc into independent, PR-sized slices. Typical outputs: **3-15+ stories** for a substantive doc; a short doc may yield fewer. Do not collapse unrelated work into one story.\n5. **Reserve ids** - for each planned story (in ascending order), call `POST /api/projects/{pid}/stories/reserve-id` once per file. Use each returned `id` exactly; do not glob `story-*.md` or reuse ids. After each reserve, `.s_e_e/planning/next-id` reflects the next suffix (confirmation only).\n6. **Create each story file** - for every planned story, write `.s_e_e/planning/stories/story-<n> - <Kebab-Title>.md` where `<Kebab-Title>` matches frontmatter `title` with spaces replaced by `-`.\n\nRequired file shape (each story):\n- YAML frontmatter: `id: story-<n>`, `title`, `status: New`, `assignee: []`, `created_date` / `updated_date` as `'YYYY-MM-DD HH:mm'`, `labels`, `dependencies` (only lower-numbered `story-<m>` ids), `priority` (`low` | `medium` | `high`).\n- Include label `doc-<n>` matching the source doc on every story.\n- Sections with HTML comment markers exactly as in `.agents/skills/stories/SKILL.md`: Description (`<!-- SECTION:DESCRIPTION:BEGIN -->` / `END`), Acceptance Criteria (`<!-- AC:BEGIN -->` / `END`), Implementation Plan (`<!-- SECTION:PLAN:BEGIN -->` / `END`), Implementation Notes (empty), Final Summary (empty).\n\nStory quality (must, every story):\n- **Atomic** - one PR-sized change; typically one or two source files plus tests.\n- **Testable** - every AC is an outcome verifiable by running tests, inspecting files, or calling an HTTP endpoint.\n- **AI-implementable** - Implementation Plan lists exact file paths/modules to touch and concrete steps; no vague \"update the module\" bullets.\n- **Work-ready** - include at least one AC for automated test coverage of the change.\n- Number each AC: `- [ ] #1 ...` (outcome form, not implementation steps).\n- Description states goal and scope only; put how-to in Implementation Plan, not Description or AC.\n- Leave Implementation Notes and Final Summary empty between their markers.\n- **Dependency-safe** - when story B requires A's outcome, set `dependencies: [story-<m>]` with lower ids only.\n\nDo not edit the source doc, other existing stories, milestones, or unrelated knowledge files.\n\nReferences:\n- `.agents/skills/stories/SKILL.md`\n- `.agents/skills/work/SKILL.md`\n- `.agents/skills/doc/SKILL.md`\n- `.s_e_e/knowledge/docs/overview/stories/doc-2 - 2-Stories-and-Knowledge.md`\n\nDeliverable: all new story markdown files saved on disk; report a table of story id, filename, title, priority, dependencies, and a one-line scope summary for each.",
  "created_at": "2026-07-04T11:34:01.587043816Z"
}